Year,Problem,Task,Type,Notes
2018,Q,Q6,Recognition,Fill in blanks in English rule statement and identify rule-violating word
2018,Q,Q7,Recognition,Explain generalization across five languages in English
2018,R,R1,Recognition,Decode parser output to determine what a message said
2018,R,R2,Recognition,Determine travel locations from decoded parser output
2018,R,R3,Recognition,Identify which city can be encoded and explain why others cannot
2018,R,R4,Production,Write an English sentence that encodes a city name via formal parser
2022,A,A1,Recognition,Identify which Avoiuli script words correspond to given Bislama words
2022,A,A2,Recognition,Identify which Avoiuli script words correspond to given English meanings
2022,A,A3,Recognition,Identify the geographical area mentioned on the sign
2022,B,B1,Production,Translate Turkish→English and English→Turkish (mixed; includes production)
2022,B,B2,Production,Translate Turkish→English and English→Turkish with question forms (includes production)
2022,C,C1,Recognition,Fill in blanks in feature definitions and identify sentence correspondences
2022,C,C2,Recognition,Fill in feature-score tables for new articles
2022,C,C3,Recognition,Identify sentences making up a summary
2022,C,C4,Recognition,Identify sentences making up a summary
2022,C,C5,Recognition,Identify words/phrases to fix in abstractive summary
2022,C,C6,Recognition,Identify word with incorrect meaning in extractive summary
2022,D,D1,Production,Write missing Kaktovik Iñupiaq numerals in foreign script
2022,D,D2,Production,Give Iñupiaq words for given numbers
2022,D,D3,Recognition,Write Arabic numerals for Iñupiaq number words
2022,D,D4,Recognition,Write Arabic numerals for values in Kaktovik representations
2022,E,E1,Recognition,Match English sentences/phrases to Ik translations
2022,E,E2,Recognition,Translate Ik sentences word-for-word into English
2022,E,E3,Production,Translate English words/sentences into Ik
2022,E,E4,Recognition,Translate Ik sentences into English
2022,E,E5,Recognition,Select which phrase is grammatical
2022,E,E6,Recognition,State a rule describing when Ik speakers devoice vowels
2022,E,E7,Recognition,Give sentence numbers supporting claim about Ik adjectives
2022,F,F1,Recognition,Match Ende sentences to English translations
2022,F,F2,Recognition,Provide English translations for Ende words
2022,F,F3,Production,Provide Ende translations for English words
2022,F,F4,Recognition,Circle Ende words that would appear in a translation
2022,G,G1,Recognition,Determine which number was misread from a letter representation
2022,G,G2,Recognition,Decode positional letter representation to recover English message
2022,G,G3,Recognition,Decode alternative positional letter representation
2022,G,G4,Recognition,Decode tree-path letter representation
2022,G,G5,Recognition,Decode Wickelletter representation
2022,H,H1,Recognition,Identify which food does not follow normal Tseltal rules
2022,H,H2,Recognition,Translate Tseltal sentence into English
2022,H,H3,Production,Translate English sentences into Tseltal
2022,H,H4,Recognition,Identify correct Tseltal word for a specific food
2022,H,H5,Recognition,Identify correct Tseltal word for another specific food
2022,H,H6,Recognition,Determine what English plant a Tseltal name translates to
2022,I,I1,Production,Fill in gaps in Cornish noun table with correct word forms
2022,I,I2,Production,Fill in blanks requiring Cornish word production and English meanings
2022,I,I3,Recognition,Identify which animal's name comes from a Welsh phrase
2022,J,J1,Production,Predict how a speaker would pronounce English words using their idiosyncratic system
2022,J,J2,Recognition,Interpret a speaker's utterances to determine intended English words
2022,K,K1,Recognition,Match Wik-Mungkan words to English translations
2022,K,K2,Production,Translate English words into Wik-Mungkan
2022,K,K3,Recognition,Translate Wik-Mungkan words and phrases into English
2022,L,L1,Recognition,Determine FST phoneme-string output for English words
2022,L,L2,Recognition,Identify which word forces FST to backtrack
2022,L,L3,Recognition,Determine FST output for two words given path-validity constraint
2022,L,L4,Recognition,Match arrows to labels in a second FST
2022,L,L5,Recognition,Determine letter sequence produced by reversed FST
2022,M,M1,Recognition,Match algorithm names to table labels based on F1-score data
2022,M,M2,Recognition,Calculate F1-score under alternative segmentation
2022,M,M3,Production,Draw finite-state transducers implementing two algorithms
2022,N,N1,Recognition,Circle noun forms following a common Dinka pattern
2022,N,N2,Production,Fill in missing Dinka verb forms
2022,N,N3,Production,Predict missing singular or plural forms for Dinka nouns
2022,N,N4,Recognition,Explain observed patterns in Dinka nouns and verbs in English
2022,O,O1,Production,Translate English sentences into Iyo'awujwa'
2022,O,O2,Recognition,Describe Iyo'awujwa' verb formation patterns in English
2022,P,P1,Recognition,Fill in missing description components for food database entries
2022,P,P2,Recognition,Fill in missing estimated values in food database
2022,P,P3,Recognition,Describe how estimated values are determined in English
2022,P,P4,Recognition,Identify what type of information each facet letter corresponds to
2022,P,P5,Recognition,Describe what specific facets mean in English
2022,P,P6,Recognition,Name a food ingredient with a given facet code
2022,P,P7,Production,Write food descriptions in formal facet notation for given IDs
2022,P,P8,Recognition,Determine whether an extra facet improves accuracy and explain
2022,Q,Q1,Recognition,Translate Niuean sentences into English
2022,Q,Q2,Production,Translate English sentences into Niuean
2022,Q,Q3,Recognition,Describe observed patterns of Niuean grammar in English
2022,R,R1,Recognition,Fill in environment conditions and phoneme outputs for orthographic y rules
2022,R,R2,Recognition,Fill in environment conditions and phoneme outputs for p/t/k rules
2022,R,R3,Production,Produce phonetic transcriptions for new Carib words using derived rules
2022,R,R4,Recognition,Explain G2P rules developed for Carib in English
2024,A,A1,Recognition,Match numbered abbreviations to blank slots for given Latin words
2024,A,A2,Recognition,Identify which abbreviated form does NOT match the others
2024,A,A3,Recognition,Identify which symbol functions like the ampersand
2024,A,A4,Production,Write abbreviated forms for Latin words using a symbol bank
2024,A,A5,Recognition,Identify the English word spelled by leftover symbols
2024,B,B1,Production,Write Warlpiri sentences (translate English into Warlpiri)
2024,B,B2,Recognition,Circle two Warlpiri words with the same meaning
2024,B,B3,Recognition,Choose correct Warlpiri locative form for each given phrase (A or B)
2024,C,C1,Recognition,Determine whether each Ewe name is female or male
2024,C,C2,Recognition,Match dates to Ewe names
2024,C,C3,Recognition,Select which date a child named Kofi could have been born
2024,C,C4,Recognition,Select which name fits a child born on a given date
2024,C,C5,Recognition,Translate Ewe day names into English
2024,D,D1,Recognition,Fill in missing grammaticality judgments in a table
2024,D,D2,Recognition,Identify what hidden words stand for
2024,D,D3,Recognition,Count sentences matching grammaticality judgments
2024,D,D4,Recognition,Decode cipher-encoded words produced by the robot
2024,E,E1,Recognition,Match katakana characters to Japanese flag semaphore images
2024,E,E2,Recognition,Circle which katakana character corresponds to the unused semaphore image
2024,F,F1,Production,Produce Paiwan progressive verb forms for given verb stems
2024,G,G1,Recognition,Circle which shape a rational speaker means by saying "circle"
2024,G,G2,Recognition,Select best description for each shape from provided list
2024,G,G3,Recognition,Select best description for each shape from provided list (extended)
2024,G,G4,Recognition,Fill in missing error rate values in table
2024,G,G5,Recognition,Fill in blanks in a loss equation
2024,G,G6,Recognition,Circle which weight values cause one-word descriptions for all shapes
2024,H,H1,Production,Write Tariana statements with correct evidential markers
2024,H,H2,Recognition,Identify correct Tariana word to fill blank in accusation sentence
2024,H,H3,Recognition,Circle which evidence types each Tariana statement implies
2024,H,H4,Production,Write Tariana statements for given scenarios with specific evidentials
2024,I,I1,Recognition,Match Scottish Gaelic place names to English meanings
2024,I,I2,Recognition,Identify which Gaelic word corresponds to two different English meanings
2024,J,J1,Recognition,Match user utterances to NACLaude responses by filter triggered
2024,J,J2,Recognition,Identify how NACLaude parsed compound nouns and what they should be
2024,K,K1,Production,Produce Hungarian locative suffixed forms for city names
2024,K,K2,Recognition,Explain observations about Hungarian locative structure in English
2024,L,L1,Recognition,Translate Coptic phrases into English
2024,L,L2,Production,Translate English phrases into Coptic
2024,L,L3,Recognition,Describe observations about Coptic grammar in English
2024,M,M1,Recognition,Match Maonan words/phrases to English translations
2024,M,M2,Recognition,Translate Maonan phrases into English
2024,M,M3,Production,Translate English words/phrases into Maonan
2024,M,M4,Recognition,Explain difference between two Maonan words and suggest English translation
2024,M,M5,Recognition,Explain observations about Maonan grammar and word formation
2024,N,N1,Recognition,Identify what information is represented by the RNN's fourth unit
2024,N,N2,Recognition,Match sentences to correct RNN unit value plots
2024,N,N3,Production,Write English sentences that could have generated given RNN plots
2024,N,N4,Production,Complete plots showing RNN unit values for given sentences
2024,N,N5,Recognition,Fill in unit-ablation prediction table and provide sentence start
2024,O,O1,Recognition,Fill in missing demonstrative forms in cross-linguistic table
2024,O,O2,Recognition,Identify property encoded by both Waray and Buru demonstratives
2024,O,O3,Recognition,Identify which Buru demonstrative has additional meaning
2024,O,O4,Recognition,Describe when each Seri demonstrative can be used
2024,P,P1,Recognition,Add syllable boundaries to Kilivila words
2024,P,P2,Recognition,Mark stressed syllable for Kilivila words
2024,P,P3,Production,Provide complete pronunciations (syllable boundaries + stress) for Kilivila words
2024,P,P4,Recognition,Explain observations about Kilivila stress and syllabification
2024,Q,Q1,Recognition,Match Jakaltek number words to their digit equivalents
2024,Q,Q2,Recognition,Translate Jakaltek number words into digits
2024,Q,Q3,Production,Write Jakaltek words for given numbers
2024,Q,Q4,Recognition,Explain structure of the Jakaltek numbering system
2024,R,R1,Recognition,Match future-dialect sentences to phonological rules
2024,R,R2,Recognition,Identify which Romance languages correspond to nodes in family tree
2024,R,R3,Recognition,Fill in blanks in phonological rule machine
2024,R,R4,Production,Produce Western Romance descendant forms from Latin words
2025,A,A1,Production,Construct Totonac sentences describing new motion events
2025,B,B1,Production,Generate new Kri words for given English descriptions
2025,B,B2,Recognition,Match Kri words to English meanings
2025,B,B3,Production,Identify and write the Kri word for a given English phrase
2025,C,C1,Recognition,Determine which object each letter refers to in Berlin-Kay color rules
2025,C,C2,Recognition,Indicate whether color words follow rules for each language
2025,C,C3,Recognition,Choose possible color words for blank cells while following rules
2025,D,D1,Recognition,Identify which test run used a pivot language and name it
2025,D,D2,Recognition,Select possible translation results for given color terms
2025,D,D3,Recognition,Match test runs to pivot languages
2025,E,E1,Recognition,Match Armenian script country names to English equivalents
2025,E,E2,Recognition,Write Latin-alphabet pronunciation of country names in Armenian
2025,E,E3,Production,Write country names in Armenian script
2025,F,F1,Recognition,Fill in missing correct/chatbot answers in cipher-decoding table
2025,F,F2,Recognition,Fill in NacloChat's incorrect acronym answers
2025,F,F3,Recognition,Select whether chatbot produced N-1 or N+1 for each list length
2025,G,G1,Recognition,Translate Sakata sentences into English
2025,G,G2,Production,Translate English sentences into Sakata
2025,G,G3,Production,Translate English noun phrases (counts) into Sakata
2025,H,H1,Recognition,Match Proto-Basque words to numbers 1-9
2025,H,H2,Recognition,Match Proto-Basque word-parts to English meanings
2025,H,H3,Recognition,Determine which modern Basque numbers correspond to 5-10
2025,I,I1,Recognition,Fill in cuneiform glyph table by matching glyphs from bank
2025,I,I2,Production,Draw the Sumerian cuneiform glyph for "man"
2025,I,I3,Recognition,Identify literal translation components of a cuneiform word
2025,I,I4,Recognition,Describe how cuneiform script changed over time in English
2025,J,J1,Recognition,Match Nganasan words to English meanings
2025,J,J2,Recognition,Translate Nganasan words into English
2025,J,J3,Production,Translate English words into Nganasan
2025,J,J4,Production,Suggest a Nganasan translation for an English phrase
2025,K,K1,Recognition,Identify grammatical category of words labeled YES by classifier
2025,K,K2,Recognition,Compute a dot product and write the resulting number
2025,K,K3,Recognition,Identify which classifier matches each context and write English context sentences
2025,K,K4,Recognition,Provide English words that could be represented by given vectors
2025,L,L1,Production,Fill in missing whistled and spoken Kickapoo forms
2025,L,L2,Production,Give whistled Kickapoo form for a theorized old word
2025,L,L3,Recognition,Explain how a Kickapoo word's whistled form is derived
2025,M,M1,Recognition,Match English translations to Irish sentences
2025,M,M2,Recognition,Translate Irish sentences into English
2025,M,M3,Production,Translate English sentences into Irish
2025,M,M4,Recognition,Explain observations about the Irish language in English
2025,N,N1,Recognition,Fill in Nancowry word table using morphological patterns
2025,N,N2,Recognition,Match additional Nancowry words to English meanings
2025,N,N3,Recognition,Explain how words are formed in Nancowry in English
2025,O,O1,Recognition,Fill in family tree gaps with correct language names
2025,O,O2,Recognition,Match statements to English translations
2025,O,O3,Recognition,Match statements to their speakers
2025,O,O4,Production,Write a sentence in Kotiria (Ricardo's patrilect)
2025,O,O5,Production,Write another sentence in Kotiria conveying specific information
2025,O,O6,Recognition,Match spouses to family members
2025,O,O7,Recognition,Identify a character's matrilineal language from context
2025,P,P1,Recognition,Translate Kwomtari sentences into English
2025,P,P2,Production,Translate English sentences into Kwomtari
2025,P,P3,Recognition,Explain observations about Kwomtari in English
